{
  "schema_version": "tts-quality-blind-session-v1",
  "session_id": "omnivoice-selective-stress-blind-20260901",
  "rated_at": "2026-09-01T11:43:32Z",
  "method": "single-listener blind A/B preference; not MOS",
  "reveal_mapping_path": "../outputs/blind/omnivoice-selective-stress-blind-20260901/reveal.json",
  "cases": [
    {
      "case_id": "homograph-zamok",
      "preferred_label": "B",
      "verdict": "preference",
      "notes": "",
      "dimension_ratings": {
        "pronunciation": {"preferred_label": "B", "verdict": "preference"},
        "prosody": {"preferred_label": "B", "verdict": "preference"},
        "speaker_stability": {"preferred_label": "B", "verdict": "preference"}
      }
    },
    {
      "case_id": "homograph-muka",
      "preferred_label": "A",
      "verdict": "preference",
      "notes": "",
      "dimension_ratings": {
        "pronunciation": {"preferred_label": "A", "verdict": "preference"},
        "prosody": {"preferred_label": null, "verdict": "tie"},
        "speaker_stability": {"preferred_label": null, "verdict": "tie"}
      }
    },
    {
      "case_id": "homograph-plachu",
      "preferred_label": "B",
      "verdict": "preference",
      "notes": "",
      "dimension_ratings": {
        "pronunciation": {"preferred_label": "B", "verdict": "preference"},
        "prosody": {"preferred_label": null, "verdict": "tie"},
        "speaker_stability": {"preferred_label": null, "verdict": "tie"}
      }
    },
    {
      "case_id": "homograph-atlas",
      "preferred_label": "A",
      "verdict": "preference",
      "notes": "",
      "dimension_ratings": {
        "pronunciation": {"preferred_label": null, "verdict": "tie"},
        "prosody": {"preferred_label": null, "verdict": "tie"},
        "speaker_stability": {"preferred_label": null, "verdict": "tie"}
      }
    },
    {
      "case_id": "homograph-organ",
      "preferred_label": "A",
      "verdict": "preference",
      "notes": "",
      "dimension_ratings": {
        "pronunciation": {"preferred_label": "A", "verdict": "preference"},
        "prosody": {"preferred_label": null, "verdict": "tie"},
        "speaker_stability": {"preferred_label": null, "verdict": "tie"}
      }
    },
    {
      "case_id": "homograph-strelki",
      "preferred_label": null,
      "verdict": "tie",
      "notes": "",
      "dimension_ratings": {
        "pronunciation": {"preferred_label": null, "verdict": "both_bad"},
        "prosody": {"preferred_label": null, "verdict": "tie"},
        "speaker_stability": {"preferred_label": null, "verdict": "tie"}
      }
    },
    {
      "case_id": "homograph-uzhe",
      "preferred_label": "B",
      "verdict": "preference",
      "notes": "",
      "dimension_ratings": {
        "pronunciation": {"preferred_label": "B", "verdict": "preference"},
        "prosody": {"preferred_label": null, "verdict": "tie"},
        "speaker_stability": {"preferred_label": null, "verdict": "tie"}
      }
    },
    {
      "case_id": "homograph-belki",
      "preferred_label": null,
      "verdict": "both_bad",
      "notes": "в одном варианте оба раза на первый слог во втором оба раза на второй слог",
      "dimension_ratings": {
        "pronunciation": {"preferred_label": null, "verdict": "both_bad"},
        "prosody": {"preferred_label": null, "verdict": "tie"},
        "speaker_stability": {"preferred_label": null, "verdict": "tie"}
      }
    }
  ]
}
