{
  "schema_version": "tts-quality-blind-session-v1",
  "session_id": "omnivoice-morphology-blind-20260901",
  "rated_at": "2026-09-01T11:49:40Z",
  "method": "single-listener blind A/B preference; not MOS",
  "reveal_mapping_path": "../outputs/blind/omnivoice-morphology-blind-20260901/reveal.json",
  "cases": [
    {
      "case_id": "dates-numeric-and-words",
      "preferred_label": "A",
      "verdict": "preference",
      "notes": "",
      "dimension_ratings": {
        "pronunciation": {"preferred_label": "A", "verdict": "preference"},
        "prosody": {"preferred_label": null, "verdict": "tie"},
        "speaker_stability": {"preferred_label": null, "verdict": "tie"}
      }
    },
    {
      "case_id": "numbers-gender-and-ordinal",
      "preferred_label": "A",
      "verdict": "preference",
      "notes": "",
      "dimension_ratings": {
        "pronunciation": {"preferred_label": "A", "verdict": "preference"},
        "prosody": {"preferred_label": null, "verdict": "tie"},
        "speaker_stability": {"preferred_label": null, "verdict": "tie"}
      }
    },
    {
      "case_id": "numbers-decimals-and-grouping",
      "preferred_label": "B",
      "verdict": "preference",
      "notes": "",
      "dimension_ratings": {
        "pronunciation": {"preferred_label": "B", "verdict": "preference"},
        "prosody": {"preferred_label": null, "verdict": "tie"},
        "speaker_stability": {"preferred_label": null, "verdict": "tie"}
      }
    },
    {
      "case_id": "units-and-percent",
      "preferred_label": "A",
      "verdict": "preference",
      "notes": "",
      "dimension_ratings": {
        "pronunciation": {"preferred_label": "A", "verdict": "preference"},
        "prosody": {"preferred_label": null, "verdict": "tie"},
        "speaker_stability": {"preferred_label": null, "verdict": "tie"}
      }
    },
    {
      "case_id": "money-rubles-and-dollars",
      "preferred_label": "B",
      "verdict": "preference",
      "notes": "",
      "dimension_ratings": {
        "pronunciation": {"preferred_label": "B", "verdict": "preference"},
        "prosody": {"preferred_label": null, "verdict": "tie"},
        "speaker_stability": {"preferred_label": null, "verdict": "tie"}
      }
    },
    {
      "case_id": "roman-book-and-chapter",
      "preferred_label": "B",
      "verdict": "preference",
      "notes": "",
      "dimension_ratings": {
        "pronunciation": {"preferred_label": "B", "verdict": "preference"},
        "prosody": {"preferred_label": null, "verdict": "tie"},
        "speaker_stability": {"preferred_label": null, "verdict": "tie"}
      }
    },
    {
      "case_id": "roman-century-and-rulers",
      "preferred_label": null,
      "verdict": "both_bad",
      "notes": "",
      "dimension_ratings": {
        "pronunciation": {"preferred_label": null, "verdict": "both_bad"},
        "prosody": {"preferred_label": null, "verdict": "tie"},
        "speaker_stability": {"preferred_label": null, "verdict": "tie"}
      }
    },
    {
      "case_id": "chapter-transition-scene",
      "preferred_label": "A",
      "verdict": "preference",
      "notes": "",
      "dimension_ratings": {
        "pronunciation": {"preferred_label": "A", "verdict": "preference"},
        "prosody": {"preferred_label": null, "verdict": "tie"},
        "speaker_stability": {"preferred_label": null, "verdict": "tie"}
      }
    }
  ]
}
